{
  "$schema": "../content/schema/localized-entries.schema.json",
  "schemaVersion": 1,
  "packId": "local.example.private-pack",
  "locale": "de",
  "entries": [
    {
      "id": "local.example.feature.steady-hand",
      "kind": "feature",
      "name": "Ruhige Hand",
      "summary": "Fiktives Platzhaltermerkmal zum Testen des privaten Paketformats.",
      "beginnerTip": "Ersetze diesen vollständig fiktiven Eintrag durch Fakten, die du verwenden darfst.",
      "keywords": ["beispiel", "privat", "merkmal"],
      "automation": {
        "level": "informational",
        "command": null,
        "actionCost": null,
        "requiresTableInput": false
      },
      "source": {
        "work": "Projekteigene Vorlagen-Testdaten",
        "locator": "Private Vorlage",
        "adaptation": "Fiktives Beispiel; keine externe Quelle verwendet."
      }
    }
  ]
}
